### ISSUE TITLE
Performance of C-Store With TCP ACK Delay

### ISSUE THREAD

**Issue by HanaSongem** [fo-dicom/fo-dicom#2110]
Environment: Bandwidth 1000Mbps, Client: Windows 10/Red Hat Enterprise Linux 9.6, Network latency less than 1ms.

Scenario A:
SCU: fo-dicom
SCP: dcmtk's storescp utility, launched with the command ./storescp 3333 --ignore.
With a single-threaded C-Store, the bandwidth utilization only reaches around 120 Mbps.

Scenario B:
SCU: fo-dicom
SCP: fo-dicom
With a single-threaded C-Store, the bandwidth utilization can reach 700 Mbps or higher.

Packet capture analysis revealed that in Scenario A, most of the delay occurs when the server sends a C-STORE-RSP back to the client. The client's final ACK response is significantly delayed, with most RTT (Round Trip Time) taking around 40ms. This is suspected to be related to ACK Delay.

On a Windows host, setting TcpAckFrequency to 1 to disable delayed ACKs and restarting the computer allowed the bandwidth utilization to reach 700 Mbps. Subsequent packet captures showed a significant reduction in RTT latency. It is highly likely that the issue was caused by TCP ACK Delay.

Why does Scenario B not exhibit this issue?
Packet capture analysis shows that when using fo-dicom as the server, multiple C-STORE requests are sent asynchronously over the same connection between the server and client, without waiting for C-STORE-RSP responses. This means the next C-STORE is sent immediately, avoiding ACK Delay.

**What is, according to you, missing from fo-dicom? Please describe.**
fo-dicom lacks a method to prevent TCP ACK delay.

**Describe the solution you'd like**
Support configuring whether TCP ACK Delay takes effect in DicomClient, similar to the TcpNoDelay property (used to disable the TCP Nagle algorithm).

**Describe possible alternatives or existing workarounds you've considered**
Windows system: Setting TcpAckFrequency to 1 can resolve this issue, but it will affect the entire system.
Linuxe system: Re-sets TCP_QUICKACK=1 immediately after data is received. 
```
 private void RefreshQuickAck()
 {
     try { _socket.SetRawSocketOption(6, 12, QuickAckOn); }
     catch { /* socket already closed or OS does not support the option; ignore */ }
 }

 public override async ValueTask<int> ReadAsync(
     Memory<byte> buffer, CancellationToken ct = default)
 {
     var n = await _inner.ReadAsync(buffer, ct).ConfigureAwait(false);
     if (n > 0 && OperatingSystem.IsLinux()) RefreshQuickAck();
     return n;
 }
```

**Comment by gofal** [comment]
But with the option TcpNoDelay you are turning the Nagle algorithm off and the Ack delay will no longer take affect. So why is that not the solution to your issue?
or configuring a bigger maxpdu size on both sides (the client and the server), so the number of ack-packages and therefore the delays will be reduced.

**Comment by HanaSongem** [comment]
After checking some information online, my understanding is that these are two different parameters. TCP_Nodelay affects the data transmission of the sender, while TCP_QuickACK affects the ACK transmission of the receiver. You can refer to the link below:
[https://learn.microsoft.com/en-us/troubleshoot/windows-server/networking/registry-entry-control-tcp-acknowledgment-behavior#:~:text=%EE%80%80TcpAckFrequency%EE%80%81isaregistryentrythatdeterminesthenumberofTCPacknowledgments(ACKs)thatwillbeoutstandingbeforethedelayedACKtimerisignored.](url)
[https://www.funwithlinux.net/blog/set-tcp-quickack-and-tcp-nodelay/](url)

The TcpNoDelay parameter has already been set to True, and I have also tried increasing the PDU size, but it didn’t yield any improvement. Here is the summary of the network packets:There is a 40ms time difference between packets 1532 and 1536.
```1519	13.681571	fo-dicomSCU	dcmtkSCP	DICOM	36820	P-DATA, PDV Fragment, CT Image Storage Fragment
1520	13.681596	dcmtkSCP	fo-dicomSCU	TCP	60	3333 → 62062 [ACK] Seq=1989 Ack=939653 Win=2097920 Len=0
1521	13.681695	dcmtkSCP	fo-dicomSCU	TCP	60	3333 → 62062 [ACK] Seq=1989 Ack=950933 Win=2097920 Len=0
1522	13.681781	dcmtkSCP	fo-dicomSCU	TCP	60	3333 → 62062 [ACK] Seq=1989 Ack=960803 Win=2097920 Len=0
1523	13.681903	dcmtkSCP	fo-dicomSCU	TCP	60	3333 → 62062 [ACK] Seq=1989 Ack=974903 Win=2097920 Len=0
1524	13.681949	dcmtkSCP	fo-dicomSCU	TCP	60	3333 → 62062 [ACK] Seq=1989 Ack=979133 Win=2097920 Len=0
1525	13.682051	dcmtkSCP	fo-dicomSCU	TCP	60	3333 → 62062 [ACK] Seq=1989 Ack=991823 Win=2097920 Len=0
1526	13.682116	dcmtkSCP	fo-dicomSCU	TCP	60	3333 → 62062 [ACK] Seq=1989 Ack=1001693 Win=2097920 Len=0
1527	13.682335	dcmtkSCP	fo-dicomSCU	TCP	60	3333 → 62062 [ACK] Seq=1989 Ack=1015793 Win=2097920 Len=0
1528	13.682335	dcmtkSCP	fo-dicomSCU	TCP	60	3333 → 62062 [ACK] Seq=1989 Ack=1020023 Win=2097920 Len=0
1529	13.682633	dcmtkSCP	fo-dicomSCU	TCP	60	3333 → 62062 [ACK] Seq=1989 Ack=1034123 Win=2097920 Len=0
1530	13.682768	dcmtkSCP	fo-dicomSCU	TCP	60	3333 → 62062 [ACK] Seq=1989 Ack=1048223 Win=2097920 Len=0
1531	13.682882	dcmtkSCP	fo-dicomSCU	TCP	60	3333 → 62062 [ACK] Seq=1989 Ack=1059609 Win=2097920 Len=0
1532	13.682945	dcmtkSCP	fo-dicomSCU	TCP	66	3333 → 62062 [PSH, ACK] Seq=1989 Ack=1059609 Win=2097920 Len=12 [TCP segment of a reassembled PDU]
1536	13.723539	fo-dicomSCU	dcmtkSCP	TCP	54	62062 → 3333 [ACK] Seq=1059609 Ack=2001 Win=64128 Len=0
1537	13.724053	dcmtkSCP	fo-dicomSCU	DICOM	206	P-DATA, C-STORE-RSP ID=3149 (Success)
1538	13.724147	fo-dicomSCU	dcmtkSCP	TCP	54	62062 → 3333 [ACK] Seq=1059609 Ack=2153 Win=64128 Len=0 
```


If you need more information or would like me to test any solutions, please feel free to let me know. I'll provide support promptly.
