### ISSUE TITLE
mistake to generate P-DATA C-STORE-RSP 

### ISSUE THREAD

**Issue by buertlh** [fo-dicom/fo-dicom#690]
### Expected behavior
Frame 937: 152 bytes on wire (1216 bits), 152 bytes captured (1216 bits) on interface 0
Ethernet II, Src: WistronI_e8:53:e1 (54:ee:75:e8:53:e1), Dst: HewlettP_b1:41:c9 (c8:d3:ff:b1:41:c9)
Internet Protocol Version 4, Src: 192.168.0.111, Dst: 192.168.0.117
Transmission Control Protocol, Src Port: 12623, Dst Port: 50115, Seq: 4121, Ack: 535924, Len: 98
    Source Port: 12623
    Destination Port: 50115
    [Stream index: 12]
    [TCP Segment Len: 98]
    Sequence number: 4121    (relative sequence number)
    [Next sequence number: 4219    (relative sequence number)]
    Acknowledgment number: 535924    (relative ack number)
    0101 .... = Header Length: 20 bytes (5)
    Flags: 0x018 (PSH, ACK)
    Window size value: 2053
    [Calculated window size: 525568]
    [Window size scaling factor: 256]
    Checksum: 0x82b1 [unverified]
    [Checksum Status: Unverified]
    Urgent pointer: 0
    [SEQ/ACK analysis]
    TCP payload (98 bytes)
DICOM, C-STORE-RSP ID=1
    PDU Type: Unknown (0x400)
    PDU Length: 92
    PDV, C-STORE-RSP ID=1
        PDV Length: 88
        Context: 0x01 (JPEG Lossless, Non-Hierarchical, First-Order Prediction (Process 14 [Selection Value 1]): Default Transfer Syntax for Lossless JPEG Image Compression, CT Image Storage)
        Flags: 0x03 (Command, Last Fragment)
        (0000,0000)          4 Command Group Length                          74
        (0000,0002)         26 Affected SOP Class UID                        1.2.840.10008.5.1.4.1.1.2 (CT Image Storage)
        (0000,0100)          2 Command Field                                 C-STORE-RSP
        (0000,0120)          2 Message ID Being Responded To                 1
        (0000,0800)          2 Data Set Type                                 257
        (0000,0900)          2 Status                                        Success (0x00)

### Actual behavior
Frame 285: 152 bytes on wire (1216 bits), 152 bytes captured (1216 bits) on interface 0
Ethernet II, Src: IntelCor_6b:40:f9 (e4:70:b8:6b:40:f9), Dst: HewlettP_b1:41:c9 (c8:d3:ff:b1:41:c9)
Internet Protocol Version 4, Src: 192.168.0.156, Dst: 192.168.0.117
Transmission Control Protocol, Src Port: 12623, Dst Port: 49282, Seq: 187, Ack: 212410, Len: 98
DICOM, Command
    PDU Type: Unknown (0x400)
    PDU Length: 92
    PDV, Command
        PDV Length: 88
        Context: 0x01 (JPEG Lossless, Non-Hierarchical, First-Order Prediction (Process 14 [Selection Value 1]): Default Transfer Syntax for Lossless JPEG Image Compression, CT Image Storage)
        Flags: 0x03 (Command, Last Fragment)
        (8a9b,421e)      46475 Private Tag                                   [��] <incomplete>
            [Expert Info (Error/Malformed): Early termination of tag. Data is missing]

### Steps to reproduce the behavior
1. fo-dicom works as cstore-scp
2. use storesuc to store a jpeg lossless image to cstore-scp
(commond: storescu  192.168.0.111 12623  003.dcm -aec VAE_STRSCP -xs)
3. dicom file is stored successfully, but the cstore scu did not receive successful response
4. the package I captured use wireshark show the P-DATA C-STORE-RSP has mistake as above
### fo-dicom version and OS/platform
fo-dicom netcore 3.1.0

**Comment by gofal** [comment]
This error log is hard to reproduce.

There are new versions with a lot of fixes and improvements meanwhile.

Could you please try to reproduce this issue with latest version of fo-dicom (4.0.6)?
